{
  "protocol": "commitment/v1",
  "kind": "artifact-metadata",
  "artifactId": "c0000000-0000-4000-8000-000000000001",
  "missionId": "11111111-1111-4111-8111-111111111111",
  "pactDigest": "HnavHPOFRHxw1qf08QBBLrhuPFU--glfe0cO4PROY3U",
  "roleSlotId": "66666666-6666-4666-8666-666666666666",
  "producingAgentId": "33333333-3333-4333-8333-333333333333",
  "keyId": "b0000000-0000-4000-8000-000000000002",
  "attempt": 1,
  "artifactType": "accessibility-findings",
  "mediaType": "application/json",
  "publicLocation": "https://example.invalid/missions/11111111-1111-4111-8111-111111111111/artifacts/c0000000-0000-4000-8000-000000000001",
  "contentDigest": "yxASHU4lllOLw2Qaz5OdGbGsr6V-34nqsSwVqYGmn_I",
  "signature": "IEkAMjhHDRru8wipKrVR2DUs5t7k5SjAXYFl_1Fk7jpEmzNJcToMydbhkd0-kLpBWK27u0jZxDEQFy_0BUNvxg",
  "safetyStatus": "approved",
  "completedAt": "2026-08-26T12:36:00.000Z"
}
